{
  "manifest_schema_version": "2026-06",
  "app": {
    "id": "com.tesslate.crm-with-postgres",
    "slug": "crm-with-postgres",
    "name": "Tesslate CRM with Postgres",
    "version": "0.1.3",
    "description": "Matrix demo app exercising the full platform container toolbox: Next.js web surface + Node API + Postgres service container with a CSI-backed volume, secrets, and env_injection wiring.",
    "category": "productivity",
    "forkable": "true"
  },
  "compatibility": {
    "studio": {
      "min": "0.0.0"
    },
    "manifest_schema": "2026-06",
    "runtime_api": "^1.0",
    "required_features": []
  },
  "compute": {
    "tier": 1,
    "model": "always-on",
    "compute_model": "per-installer",
    "containers": [
      {
        "name": "web",
        "primary": true,
        "kind": "base",
        "image": "tesslate-devserver:latest",
        "ports": [
          3000
        ],
        "directory": "web",
        "startup_command": "sh -c '(test -d node_modules || npm install) && npm run dev'",
        "env": {
          "NODE_ENV": "development"
        }
      },
      {
        "name": "api",
        "kind": "base",
        "image": "tesslate-devserver:latest",
        "ports": [
          3001
        ],
        "directory": "api",
        "startup_command": "sh -c '(test -d node_modules || npm install) && node server.js'",
        "env": {
          "PORT": "3001"
        }
      },
      {
        "name": "db",
        "kind": "service",
        "image": "postgres:16-alpine",
        "ports": [
          5432
        ],
        "directory": "db",
        "volumes": [
          "/var/lib/postgresql/data"
        ],
        "env": {
          "POSTGRES_USER": "crm",
          "POSTGRES_PASSWORD": "${secret:pg-creds/password}",
          "POSTGRES_DB": "crm"
        }
      }
    ],
    "connections": [
      {
        "source_container": "db",
        "target_container": "api",
        "connector_type": "env_injection",
        "config": {
          "env_mapping": {
            "DATABASE_URL": "postgresql://crm:${secret:pg-creds/password}@svc-db.${NAMESPACE}.svc.cluster.local:5432/crm"
          }
        }
      }
    ]
  },
  "surfaces": [
    {
      "kind": "ui",
      "entrypoint": "/"
    }
  ],
  "state": {
    "model": "per-install-volume",
    "volume_size": "2Gi"
  },
  "schedules": [],
  "billing": {
    "ai_compute": {
      "payer": "installer",
      "markup_pct": 0
    },
    "general_compute": {
      "payer": "platform"
    },
    "platform_fee": {
      "model": "free"
    }
  },
  "listing": {
    "visibility": "public"
  }
}
